{
  "$schema": "../../schemas/underground-road.schema.json",
  "schema_version": 2,
  "id": "cobbleventure:underground_road/celadon_lavender",
  "enabled": true,
  "display_name": {
    "ko_kr": "보라마을–무지개시티 지하통로",
    "en_us": "Lavender–Celadon Underground Passage"
  },
  "dimension": {
    "id": "cobbleventure:dungeons",
    "region_id": "generation_1/celadon_lavender",
    "origin": {
      "x": 3072,
      "y": 48,
      "z": 0
    }
  },
  "modules": [
    {
      "id": "celadon_stairs",
      "structure": "cobbleventure:underground_road_modules/stairs_up",
      "position": {
        "x": 0,
        "y": 0,
        "z": 0
      },
      "rotation": "clockwise_180"
    },
    {
      "id": "straight_01",
      "structure": "cobbleventure:underground_road_modules/straight_32",
      "position": {
        "x": 16,
        "y": 0,
        "z": 1
      },
      "rotation": "none"
    },
    {
      "id": "straight_02",
      "structure": "cobbleventure:underground_road_modules/straight_32",
      "position": {
        "x": 48,
        "y": 0,
        "z": 1
      },
      "rotation": "none"
    },
    {
      "id": "straight_03",
      "structure": "cobbleventure:underground_road_modules/straight_32",
      "position": {
        "x": 80,
        "y": 0,
        "z": 1
      },
      "rotation": "none"
    },
    {
      "id": "straight_04",
      "structure": "cobbleventure:underground_road_modules/straight_32",
      "position": {
        "x": 112,
        "y": 0,
        "z": 1
      },
      "rotation": "none"
    },
    {
      "id": "lavender_stairs",
      "structure": "cobbleventure:underground_road_modules/stairs_up",
      "position": {
        "x": 144,
        "y": 0,
        "z": 1
      },
      "rotation": "none"
    }
  ]
}
